{
  "schema_version": 1,
  "module": "heyq02/moomem",
  "version": "0.2.2",
  "git_tag": "v0.2.2",
  "committed_at": "2026-10-01T00:00:00Z",
  "fixture": {
    "path": "ci/eval/locomo/data/locomo_subset.json",
    "note": "CC BY-NC 4.0 subset"
  },
  "runs": {
    "offline": {
      "embedder": "hashing",
      "model": null,
      "dim": null,
      "extractor_model": null,
      "metrics": {
        "hybrid_recall_at_5": 0.335,
        "hybrid_mrr_at_5": 0.199,
        "bm25_recall_at_5": 0.435,
        "bm25_mrr_at_5": 0.31,
        "vs_bm25_pct": -23.0,
        "target_15pct": "n_a",
        "near_dup_supersede_rate": 0.95,
        "near_dup_ok": 19,
        "near_dup_total": 20,
        "cross_user_leaks": 0,
        "reopen_ok": 1,
        "extraction_precision": null,
        "extraction_hit": null,
        "extraction_denom": null,
        "extraction_status": "skipped"
      },
      "gates": {
        "isolation": "pass",
        "persistence": "pass",
        "conflict": "pass",
        "hybrid_ge_bm25": "n_a",
        "target_15pct": "n_a",
        "extraction_precision": "skipped",
        "overall": "pass"
      },
      "status": "pass"
    },
    "api": {
      "embedder": "api",
      "model": "qwen3.7-text-embedding-flash",
      "dim": 1024,
      "extractor_model": null,
      "metrics": {
        "hybrid_recall_at_5": 0.383,
        "hybrid_mrr_at_5": 0.225,
        "bm25_recall_at_5": 0.435,
        "bm25_mrr_at_5": 0.31,
        "vs_bm25_pct": -12.0,
        "target_15pct": "missed",
        "near_dup_supersede_rate": 0.95,
        "near_dup_ok": 19,
        "near_dup_total": 20,
        "cross_user_leaks": 0,
        "reopen_ok": 1,
        "extraction_precision": null,
        "extraction_hit": null,
        "extraction_denom": null,
        "extraction_status": "skipped"
      },
      "gates": {
        "isolation": "pass",
        "persistence": "pass",
        "conflict": "pass",
        "hybrid_ge_bm25": "fail",
        "target_15pct": "fail",
        "extraction_precision": "skipped",
        "overall": "fail"
      },
      "status": "fail"
    },
    "live": {
      "embedder": "hashing",
      "model": null,
      "dim": null,
      "extractor_model": "deepseek-flash",
      "metrics": {
        "hybrid_recall_at_5": 0.335,
        "hybrid_mrr_at_5": 0.199,
        "bm25_recall_at_5": 0.435,
        "bm25_mrr_at_5": 0.31,
        "vs_bm25_pct": -23.0,
        "target_15pct": "n_a",
        "near_dup_supersede_rate": 0.95,
        "near_dup_ok": 19,
        "near_dup_total": 20,
        "cross_user_leaks": 0,
        "reopen_ok": 1,
        "extraction_precision": 0.88,
        "extraction_hit": 66,
        "extraction_denom": 75,
        "extraction_status": "scored"
      },
      "gates": {
        "isolation": "pass",
        "persistence": "pass",
        "conflict": "pass",
        "hybrid_ge_bm25": "n_a",
        "target_15pct": "n_a",
        "extraction_precision": "pass",
        "overall": "pass"
      },
      "status": "pass"
    }
  }
}
